<?xml version="1.0" encoding="UTF-8"?>
<!DOCTYPE PR SYSTEM "file:/home/pedro/Desktop/PRI/TPCS/TP2/PR.dtd">
<PR>
    <keyName>
        PRI_TP1_ProjectRec
    </keyName>
    <titulo>
        Project Record TP1 PRI
    </titulo>
    <subtitulo>
        Random Subtitle
    </subtitulo>
    <beginDate>
        Outubro 2020
    </beginDate>
    <endDate>
        Outubro 2020
    </endDate>
    <supervisor url="www.di.uminho.pt/~jcr">
        José Carlos Ramalho
    </supervisor>
    <workteam>
        <worker numero="A85919" mailURL="mailto:a85919@alunos.uminho.pt">
            <nome>
                Pedro Dias Parente
            </nome>
            <email>
                a85919@alunos.uminho.pt
            </email>
        </worker>
    </workteam>
    <abstract>
        <paragrafo>
            <texto>
                Para este trabalho, foi contruído pelo aluno um ficheiro 
            </texto>
            <bold> dtd </bold>
            <texto>
                que fosse capaz de gerar
            </texto>
            <bold> xml </bold>
            <texto>
                de acordo com as caraterísticas de um 
            </texto>
            <bold>
                Project Record.
            </bold>
        </paragrafo>
        <paragrafo>
            <texto>
                Depois de gerado o xml foi tambem usado o ficheiro gerado para fazer o próprio Project Record.
            </texto>
        </paragrafo>
    </abstract>
    <deliverables>
        <item ref="TP2.html">
            Report (HTML Version)
        </item>
        <item ref="TP2.xml">
            Report (XML Version)
        </item>
    </deliverables>
</PR>